{
  "schema_version": "1.0.0",
  "verified_at": "2026-07-16",
  "sources": [
    {"id":"openai-gpt-5-6","owner":"OpenAI","url":"https://openai.com/index/gpt-5-6/","status":"active","kind":"vendor","limitations":["vendor-reported"]},
    {"id":"arc-prize-gpt-5-6","owner":"ARC Prize Foundation","url":"https://arcprize.org/results/openai-gpt-5-6","status":"active","kind":"primary-independent","limitations":["OOD abstraction only"]},
    {"id":"artificial-analysis-gpt-5-6","owner":"Artificial Analysis","url":"https://artificialanalysis.ai/articles/gpt-5-6-has-landed","status":"active","kind":"independent-aggregator","limitations":["aggregate index"]},
    {"id":"agents-last-exam","owner":"Berkeley RDI and RDI Foundation","url":"https://agents-last-exam.org/","status":"active","kind":"primary-independent","limitations":["not every route measured"]},
    {"id":"harness-bench","owner":"Peking University and Qiyuan Tech","url":"https://www.harness-bench.ai/","status":"active","kind":"primary-independent","limitations":["harness-sensitive"]},
    {"id":"automation-bench","owner":"Zapier","url":"https://zapier.com/benchmarks","status":"active","kind":"primary-independent","limitations":["business API automation"]},
    {"id":"terminal-bench","owner":"Stanford and Laude Institute","url":"https://www.tbench.ai/","status":"active","kind":"primary-independent","limitations":["terminal domain","harness-sensitive"]},
    {"id":"browsecomp","owner":"OpenAI","url":"https://openai.com/index/browsecomp/","status":"active","kind":"vendor","limitations":["browsing domain"]},
    {"id":"osworld","owner":"XLANG Lab and academic collaborators","url":"https://osworld-v2.xlang.ai/","status":"active","kind":"primary-independent","limitations":["computer-use domain","metric protocol must be explicit"]},
    {"id":"livecodebench","owner":"LiveCodeBench","url":"https://livecodebench.github.io/","status":"active","kind":"primary-independent","limitations":["secondary algorithmic signal"]},
    {"id":"swe-bench-verified","owner":"SWE-bench","url":"https://www.swebench.com/verified.html","status":"retired","kind":"primary-independent","limitations":["contamination and task-quality concerns"]},
    {"id":"swe-bench-pro","owner":"Scale AI","url":"https://labs.scale.com/leaderboard/swe_bench_pro_public","status":"retired","kind":"primary-independent","limitations":["task and grading noise"]},
    {"id":"hle-original","owner":"Center for AI Safety and Scale AI","url":"https://lastexam.ai/","status":"retired","kind":"primary-independent","limitations":["not a direct routing oracle"]}
  ],
  "observations": [
    {"id":"arc-sol-max-agi1","source_id":"arc-prize-gpt-5-6","benchmark":"ARC-AGI series","dataset":"public evaluations","harness":"ARC Prize single-agent evaluation","model":"gpt-5.6-sol","effort":"max","topology":"single","topology_declared":true,"profile_tags":["ood","reasoning"],"metric":{"name":"arc-agi-1-public-eval","value":96.5,"unit":"percent"},"cost":null,"evaluated_at":null},
    {"id":"arc-sol-max-agi2","source_id":"arc-prize-gpt-5-6","benchmark":"ARC-AGI series","dataset":"public evaluations","harness":"ARC Prize single-agent evaluation","model":"gpt-5.6-sol","effort":"max","topology":"single","topology_declared":true,"profile_tags":["ood","reasoning"],"metric":{"name":"arc-agi-2-public-eval","value":92.5,"unit":"percent"},"cost":null,"evaluated_at":null},
    {"id":"arc-sol-max-agi3","source_id":"arc-prize-gpt-5-6","benchmark":"ARC-AGI series","dataset":"public evaluations","harness":"ARC Prize single-agent evaluation","model":"gpt-5.6-sol","effort":"max","topology":"single","topology_declared":true,"profile_tags":["ood","reasoning"],"metric":{"name":"arc-agi-3-public-demo","value":7.8,"unit":"percent"},"cost":null,"evaluated_at":null},
    {"id":"arc-sol-xhigh-agi1","source_id":"arc-prize-gpt-5-6","benchmark":"ARC-AGI series","dataset":"public evaluations","harness":"ARC Prize single-agent evaluation","model":"gpt-5.6-sol","effort":"xhigh","topology":"single","topology_declared":true,"profile_tags":["ood","reasoning"],"metric":{"name":"arc-agi-1-public-eval","value":97.5,"unit":"percent"},"cost":null,"evaluated_at":null},
    {"id":"arc-sol-xhigh-agi2","source_id":"arc-prize-gpt-5-6","benchmark":"ARC-AGI series","dataset":"public evaluations","harness":"ARC Prize single-agent evaluation","model":"gpt-5.6-sol","effort":"xhigh","topology":"single","topology_declared":true,"profile_tags":["ood","reasoning"],"metric":{"name":"arc-agi-2-public-eval","value":90.0,"unit":"percent"},"cost":null,"evaluated_at":null},
    {"id":"arc-sol-xhigh-agi3","source_id":"arc-prize-gpt-5-6","benchmark":"ARC-AGI series","dataset":"public evaluations","harness":"ARC Prize single-agent evaluation","model":"gpt-5.6-sol","effort":"xhigh","topology":"single","topology_declared":true,"profile_tags":["ood","reasoning"],"metric":{"name":"arc-agi-3-public-demo","value":7.0,"unit":"percent"},"cost":null,"evaluated_at":null},
    {"id":"arc-sol-high-agi1","source_id":"arc-prize-gpt-5-6","benchmark":"ARC-AGI series","dataset":"public evaluations","harness":"ARC Prize single-agent evaluation","model":"gpt-5.6-sol","effort":"high","topology":"single","topology_declared":true,"profile_tags":["ood","reasoning"],"metric":{"name":"arc-agi-1-public-eval","value":97.0,"unit":"percent"},"cost":null,"evaluated_at":null},
    {"id":"arc-sol-high-agi2","source_id":"arc-prize-gpt-5-6","benchmark":"ARC-AGI series","dataset":"public evaluations","harness":"ARC Prize single-agent evaluation","model":"gpt-5.6-sol","effort":"high","topology":"single","topology_declared":true,"profile_tags":["ood","reasoning"],"metric":{"name":"arc-agi-2-public-eval","value":85.4,"unit":"percent"},"cost":null,"evaluated_at":null},
    {"id":"arc-sol-high-agi3","source_id":"arc-prize-gpt-5-6","benchmark":"ARC-AGI series","dataset":"public evaluations","harness":"ARC Prize single-agent evaluation","model":"gpt-5.6-sol","effort":"high","topology":"single","topology_declared":true,"profile_tags":["ood","reasoning"],"metric":{"name":"arc-agi-3-public-demo","value":2.1,"unit":"percent"},"cost":null,"evaluated_at":null},
    {"id":"arc-sol-medium-agi1","source_id":"arc-prize-gpt-5-6","benchmark":"ARC-AGI series","dataset":"public evaluations","harness":"ARC Prize single-agent evaluation","model":"gpt-5.6-sol","effort":"medium","topology":"single","topology_declared":true,"profile_tags":["ood","reasoning"],"metric":{"name":"arc-agi-1-public-eval","value":92.5,"unit":"percent"},"cost":null,"evaluated_at":null},
    {"id":"arc-sol-medium-agi2","source_id":"arc-prize-gpt-5-6","benchmark":"ARC-AGI series","dataset":"public evaluations","harness":"ARC Prize single-agent evaluation","model":"gpt-5.6-sol","effort":"medium","topology":"single","topology_declared":true,"profile_tags":["ood","reasoning"],"metric":{"name":"arc-agi-2-public-eval","value":67.1,"unit":"percent"},"cost":null,"evaluated_at":null},
    {"id":"arc-sol-medium-agi3","source_id":"arc-prize-gpt-5-6","benchmark":"ARC-AGI series","dataset":"public evaluations","harness":"ARC Prize single-agent evaluation","model":"gpt-5.6-sol","effort":"medium","topology":"single","topology_declared":true,"profile_tags":["ood","reasoning"],"metric":{"name":"arc-agi-3-public-demo","value":1.1,"unit":"percent"},"cost":null,"evaluated_at":null},
    {"id":"arc-sol-low-agi1","source_id":"arc-prize-gpt-5-6","benchmark":"ARC-AGI series","dataset":"public evaluations","harness":"ARC Prize single-agent evaluation","model":"gpt-5.6-sol","effort":"low","topology":"single","topology_declared":true,"profile_tags":["ood","reasoning"],"metric":{"name":"arc-agi-1-public-eval","value":74.5,"unit":"percent"},"cost":null,"evaluated_at":null},
    {"id":"arc-sol-low-agi2","source_id":"arc-prize-gpt-5-6","benchmark":"ARC-AGI series","dataset":"public evaluations","harness":"ARC Prize single-agent evaluation","model":"gpt-5.6-sol","effort":"low","topology":"single","topology_declared":true,"profile_tags":["ood","reasoning"],"metric":{"name":"arc-agi-2-public-eval","value":42.5,"unit":"percent"},"cost":null,"evaluated_at":null},
    {"id":"arc-sol-low-agi3","source_id":"arc-prize-gpt-5-6","benchmark":"ARC-AGI series","dataset":"public evaluations","harness":"ARC Prize single-agent evaluation","model":"gpt-5.6-sol","effort":"low","topology":"single","topology_declared":true,"profile_tags":["ood","reasoning"],"metric":{"name":"arc-agi-3-public-demo","value":0.3,"unit":"percent"},"cost":null,"evaluated_at":null},

    {"id":"arc-terra-max-agi1","source_id":"arc-prize-gpt-5-6","benchmark":"ARC-AGI series","dataset":"public evaluations","harness":"ARC Prize single-agent evaluation","model":"gpt-5.6-terra","effort":"max","topology":"single","topology_declared":true,"profile_tags":["ood","reasoning"],"metric":{"name":"arc-agi-1-public-eval","value":96.5,"unit":"percent"},"cost":null,"evaluated_at":null},
    {"id":"arc-terra-max-agi2","source_id":"arc-prize-gpt-5-6","benchmark":"ARC-AGI series","dataset":"public evaluations","harness":"ARC Prize single-agent evaluation","model":"gpt-5.6-terra","effort":"max","topology":"single","topology_declared":true,"profile_tags":["ood","reasoning"],"metric":{"name":"arc-agi-2-public-eval","value":83.9,"unit":"percent"},"cost":null,"evaluated_at":null},
    {"id":"arc-terra-max-agi3","source_id":"arc-prize-gpt-5-6","benchmark":"ARC-AGI series","dataset":"public evaluations","harness":"ARC Prize single-agent evaluation","model":"gpt-5.6-terra","effort":"max","topology":"single","topology_declared":true,"profile_tags":["ood","reasoning"],"metric":{"name":"arc-agi-3-public-demo","value":0.8,"unit":"percent"},"cost":null,"evaluated_at":null},